{
  "contract": "1.0",
  "usId": "US-EVAL-006",
  "title": "the-internet: Dynamically Loaded Page Elements (Dynamic Loading, examples 1 & 2)",
  "status": "review",
  "generatedAt": "2026-07-30T22:41:44Z",
  "base": "eval/skill-eval-campaign-2026-07-29/US-EVAL-006-the-internet-dynamic-loading",
  "producers": [
    {
      "plugin": "qaia-core",
      "version": "0.2.19",
      "skill": "us-ingest",
      "at": "2026-07-29T00:00:00Z"
    },
    {
      "plugin": "qaia-core",
      "version": "0.2.19",
      "skill": "us-review",
      "at": "2026-07-29T00:00:00Z"
    },
    {
      "plugin": "qaia-core",
      "version": "0.2.19",
      "skill": "need-understanding",
      "at": "2026-07-29T00:00:00Z"
    },
    {
      "plugin": "qaia-core",
      "version": "0.2.19",
      "skill": "istqb-design",
      "at": "2026-07-29T00:00:00Z"
    },
    {
      "plugin": "qaia-core",
      "version": "0.2.19",
      "skill": "prioritize",
      "at": "2026-07-29T00:00:00Z"
    },
    {
      "plugin": "qaia-core",
      "version": "0.2.19",
      "skill": "testbook-generate",
      "at": "2026-07-29T00:00:00Z"
    },
    {
      "plugin": "qaia-playwright",
      "version": "0.2.4",
      "skill": "run-report",
      "at": "2026-07-30T22:41:44Z"
    }
  ],
  "artifacts": [
    {
      "kind": "feature",
      "format": "gherkin",
      "path": "testbooks/dynamic-loading.feature"
    },
    {
      "kind": "synthesis",
      "format": "markdown",
      "path": "testbooks/synthesis.md"
    },
    {
      "kind": "matrix",
      "format": "markdown",
      "path": "testbooks/coverage-matrix.md"
    },
    {
      "kind": "execution",
      "format": "junit",
      "path": "runs/results-run5.junit.xml"
    },
    {
      "kind": "execution",
      "format": "cucumber-json",
      "path": "runs/cucumber.json"
    },
    {
      "kind": "execution",
      "format": "html",
      "path": "runs/report.html"
    }
  ],
  "design": {
    "scenarios": {
      "total": 4,
      "byPriority": {
        "P1": 1,
        "P2": 3,
        "P3": 0
      },
      "negative": 0,
      "smoke": 0,
      "outlines": 0
    },
    "coverage": {
      "acTotal": 7,
      "acCovered": 3,
      "reqNegTotal": 0,
      "reqNegCovered": 0,
      "negativeRatio": 0.0
    },
    "confidence": {
      "lowConfidence": 1,
      "openQuestions": 0,
      "assumptions": 2,
      "simulated": 5
    },
    "techniques": [
      "ep",
      "state-transition"
    ],
    "oracles": [],
    "knowledgeApplied": []
  },
  "openArbitrations": [
    {
      "id": "Q1",
      "kind": "assumption",
      "about": "no scenario generated for a forced/programmatic second click while a reveal timer is pending -- no real pointer-reachable path in either example",
      "sourceCheckpoint": "state/US-EVAL-006/02-understanding.md"
    },
    {
      "id": "Q2",
      "kind": "assumption",
      "about": "the 5000ms delay is treated as a lower bound (standard setTimeout semantics), not an exact instant -- affects the wait strategy used by automation, not the asserted DOM states",
      "sourceCheckpoint": "state/US-EVAL-006/02-understanding.md"
    },
    {
      "id": "P3-scope",
      "kind": "simulated",
      "about": "5 P3 conditions deferred by default P1+P2 scope, not generated this run -- human call per prioritize step 4",
      "sourceCheckpoint": "state/US-EVAL-006/04-priorities.md"
    },
    {
      "id": "negative-ratio",
      "kind": "simulated",
      "about": "0% negative ratio, honestly reported and explained rather than padded -- no in-scope condition qualifies as a refusal/error/deny under testbook-generate's closed @negative definition",
      "sourceCheckpoint": "testbooks/synthesis.md"
    },
    {
      "id": "US-ID",
      "kind": "simulated",
      "about": "US-EVAL-006 confirmed non-interactively (campaign run)",
      "sourceCheckpoint": "state/US-EVAL-006/00-source.md"
    },
    {
      "id": "book-review",
      "kind": "simulated",
      "about": "generated test book (4 scenario blocks) presented and accepted as-is, non-interactive run",
      "sourceCheckpoint": "testbooks/synthesis.md"
    },
    {
      "id": "priorities",
      "kind": "simulated",
      "about": "all impact/probability/priority scores accepted as proposed, no human override",
      "sourceCheckpoint": "state/US-EVAL-006/04-priorities.md"
    },
    {
      "id": "extraction",
      "kind": "simulated",
      "about": "AC1..AC7 extraction accepted as-is, non-interactive run",
      "sourceCheckpoint": "state/US-EVAL-006/01-extraction.md"
    }
  ],
  "execution": {
    "total": 4,
    "passed": 4,
    "failed": 0,
    "blocked": 0,
    "byType": {
      "e2e-desktop": 4
    },
    "traceability": {
      "scenariosAutomated": 4,
      "scenariosTotal": 4
    }
  }
}