{
  "contract": "1.0",
  "usId": "US-EVAL-008",
  "title": "DemoBlaze: add to cart, review cart total, place an order",
  "status": "review",
  "generatedAt": "2026-07-30T00:00:00Z",
  "base": "eval/skill-eval-campaign-2026-07-29/US-EVAL-008-demoblaze",

  "producers": [
    { "plugin": "qaia-core", "version": "0.2.19", "skill": "us-ingest", "at": "2026-07-30T00:00:00Z" },
    { "plugin": "qaia-core", "version": "0.2.19", "skill": "us-review", "at": "2026-07-30T00:00:00Z" },
    { "plugin": "qaia-core", "version": "0.2.19", "skill": "need-understanding", "at": "2026-07-30T00:00:00Z" },
    { "plugin": "qaia-core", "version": "0.2.19", "skill": "istqb-design", "at": "2026-07-30T00:00:00Z" },
    { "plugin": "qaia-core", "version": "0.2.19", "skill": "prioritize", "at": "2026-07-30T00:00:00Z" },
    { "plugin": "qaia-core", "version": "0.2.19", "skill": "testbook-generate", "at": "2026-07-30T00:00:00Z" }
  ],

  "artifacts": [
    { "kind": "feature", "format": "gherkin", "path": "testbooks/cart-checkout.feature" },
    { "kind": "synthesis", "format": "markdown", "path": "testbooks/synthesis.md" },
    { "kind": "matrix", "format": "markdown", "path": "testbooks/coverage-matrix.md" }
  ],

  "design": {
    "scenarios": { "total": 10, "byPriority": { "P1": 2, "P2": 8, "P3": 0 },
                   "negative": 3, "smoke": 0, "outlines": 0 },
    "coverage": { "acTotal": 9, "acCovered": 5,
                  "reqNegTotal": 5, "reqNegCovered": 3,
                  "negativeRatio": 0.30 },
    "confidence": { "lowConfidence": 3, "openQuestions": 1, "assumptions": 2, "simulated": 5 },
    "techniques": ["ep", "decision-table", "boundary", "state-transition"],
    "oracles": [],
    "knowledgeApplied": []
  },

  "openArbitrations": [
    { "id": "Q1", "kind": "assumption", "about": "guest add-to-cart's never-surfaces-a-backend-error property is cited from source, not independently forced live",
      "sourceCheckpoint": "state/US-EVAL-008/02-understanding.md" },
    { "id": "Q2", "kind": "assumption", "about": "confirmation dialog Amount scoped to single-session, no concurrent cart modification asserted -- the un-awaited deletecart race is a named gap",
      "sourceCheckpoint": "state/US-EVAL-008/02-understanding.md" },
    { "id": "Q3", "kind": "open", "about": "is unauthenticated (guest) checkout the intended business policy, or should purchasing require login? no gate found either way in source -- human arbitration requested",
      "sourceCheckpoint": "state/US-EVAL-008/02-understanding.md" },
    { "id": "P3-scope", "kind": "simulated", "about": "11 P3 conditions deferred by default P1+P2 scope, not generated this run -- human call per prioritize step 4",
      "sourceCheckpoint": "state/US-EVAL-008/04-priorities.md" },
    { "id": "req-neg-waiver", "kind": "simulated", "about": "AC7-C1/AC7-C2 [req-neg] conditions scored P3 and are a standing priority-scoped waiver, not generated this run",
      "sourceCheckpoint": "state/US-EVAL-008/04-priorities.md" },
    { "id": "negative-ratio", "kind": "simulated", "about": "30% negative ratio, below the 40% target, honestly reported -- driven by the P3-deferred req-neg pair, not padded with mistagged scenarios",
      "sourceCheckpoint": "testbooks/synthesis.md" },
    { "id": "US-ID", "kind": "simulated", "about": "US-EVAL-008 confirmed non-interactively (campaign run)",
      "sourceCheckpoint": "state/US-EVAL-008/00-source.md" },
    { "id": "book-review", "kind": "simulated", "about": "generated test book (10 scenario blocks) presented and accepted as-is, non-interactive run",
      "sourceCheckpoint": "testbooks/synthesis.md" },
    { "id": "priorities", "kind": "simulated", "about": "all impact/probability/priority scores accepted as proposed, no human override",
      "sourceCheckpoint": "state/US-EVAL-008/04-priorities.md" },
    { "id": "extraction", "kind": "simulated", "about": "AC1..AC9 extraction accepted as-is, non-interactive run",
      "sourceCheckpoint": "state/US-EVAL-008/01-extraction.md" }
  ],

  "gate": {
    "verdict": "FAIL",
    "score": 12,
    "max": 20,
    "scoredBy": "qaia-score/aptitude-gate",
    "at": "2026-07-30T00:00:00Z",
    "reasons": [
      "AC coverage hard gate broken: design.coverage.acCovered 5 < acTotal 9 -- AC1, AC5, AC6, AC9 have no scenario in testbooks/cart-checkout.feature (coverage-matrix.md lists only AC2/AC3/AC4/AC7/AC8 rows)",
      "ADR 0001 req-neg hard gate broken: reqNegCovered 3 < reqNegTotal 5 -- AC7-C1 and AC7-C2 ([req-neg] in state/03-design.md) are P3-deferred, not generated",
      "dim 2 (ac-coverage) = 0 -- any rubric dimension at 0 is a hard FAIL",
      "dim 3 (negative-path) = 0 -- any rubric dimension at 0 is a hard FAIL",
      "recomputed rubric total 12/20 from the listed dimensions; matches gate.score written by testbook-score (no arithmetic slip)",
      "10 unresolved openArbitrations (Q1, Q2, Q3, P3-scope, req-neg-waiver, negative-ratio, US-ID, book-review, priorities, extraction) -- would independently cap at CONCERNS; reported but not the binding band here",
      "no execution section in this manifest -- the automation/ results were not merged; execution gates not evaluated"
    ],
    "waiver": null,
    "dimensions": [
      { "n": 1, "name": "atomicity", "score": 1 },
      { "n": 2, "name": "ac-coverage", "score": 0 },
      { "n": 3, "name": "negative-path", "score": 0 },
      { "n": 5, "name": "business-correctness", "score": 1 },
      { "n": 7, "name": "stable-ids-traceability", "score": 1 },
      { "n": 8, "name": "gherkin-form", "score": 1 }
    ]
  }
}
