{
  "contract": "1.0",
  "usId": "US-EVAL-008",
  "title": "DemoBlaze: add to cart, review cart total, place an order",
  "status": "review",
  "generatedAt": "2026-07-30T00:00:00Z",
  "base": "eval/skill-eval-campaign-2026-07-29/US-EVAL-008-demoblaze",
  "producers": [
    {
      "plugin": "qaia-core",
      "version": "0.2.19",
      "skill": "us-ingest",
      "at": "2026-07-30T00:00:00Z"
    },
    {
      "plugin": "qaia-core",
      "version": "0.2.19",
      "skill": "us-review",
      "at": "2026-07-30T00:00:00Z"
    },
    {
      "plugin": "qaia-core",
      "version": "0.2.19",
      "skill": "need-understanding",
      "at": "2026-07-30T00:00:00Z"
    },
    {
      "plugin": "qaia-core",
      "version": "0.2.19",
      "skill": "istqb-design",
      "at": "2026-07-30T00:00:00Z"
    },
    {
      "plugin": "qaia-core",
      "version": "0.2.19",
      "skill": "prioritize",
      "at": "2026-07-30T00:00:00Z"
    },
    {
      "plugin": "qaia-core",
      "version": "0.2.19",
      "skill": "testbook-generate",
      "at": "2026-07-30T00:00:00Z"
    }
  ],
  "artifacts": [
    {
      "kind": "feature",
      "format": "gherkin",
      "path": "testbooks/cart-checkout.feature"
    },
    {
      "kind": "synthesis",
      "format": "markdown",
      "path": "testbooks/synthesis.md"
    },
    {
      "kind": "matrix",
      "format": "markdown",
      "path": "testbooks/coverage-matrix.md"
    }
  ],
  "design": {
    "scenarios": {
      "total": 10,
      "byPriority": {
        "P1": 2,
        "P2": 8,
        "P3": 0
      },
      "negative": 3,
      "smoke": 0,
      "outlines": 0
    },
    "coverage": {
      "acTotal": 9,
      "acCovered": 5,
      "reqNegTotal": 5,
      "reqNegCovered": 3,
      "negativeRatio": 0.3
    },
    "confidence": {
      "lowConfidence": 3,
      "openQuestions": 1,
      "assumptions": 2,
      "simulated": 5
    },
    "techniques": [
      "ep",
      "decision-table",
      "boundary",
      "state-transition"
    ],
    "oracles": [],
    "knowledgeApplied": []
  },
  "openArbitrations": [
    {
      "id": "Q1",
      "kind": "assumption",
      "about": "guest add-to-cart's never-surfaces-a-backend-error property is cited from source, not independently forced live",
      "sourceCheckpoint": "state/US-EVAL-008/02-understanding.md"
    },
    {
      "id": "Q2",
      "kind": "assumption",
      "about": "confirmation dialog Amount scoped to single-session, no concurrent cart modification asserted -- the un-awaited deletecart race is a named gap",
      "sourceCheckpoint": "state/US-EVAL-008/02-understanding.md"
    },
    {
      "id": "Q3",
      "kind": "open",
      "about": "is unauthenticated (guest) checkout the intended business policy, or should purchasing require login? no gate found either way in source -- human arbitration requested",
      "sourceCheckpoint": "state/US-EVAL-008/02-understanding.md"
    },
    {
      "id": "P3-scope",
      "kind": "simulated",
      "about": "11 P3 conditions deferred by default P1+P2 scope, not generated this run -- human call per prioritize step 4",
      "sourceCheckpoint": "state/US-EVAL-008/04-priorities.md"
    },
    {
      "id": "req-neg-waiver",
      "kind": "simulated",
      "about": "AC7-C1/AC7-C2 [req-neg] conditions scored P3 and are a standing priority-scoped waiver, not generated this run",
      "sourceCheckpoint": "state/US-EVAL-008/04-priorities.md"
    },
    {
      "id": "negative-ratio",
      "kind": "simulated",
      "about": "30% negative ratio, below the 40% target, honestly reported -- driven by the P3-deferred req-neg pair, not padded with mistagged scenarios",
      "sourceCheckpoint": "testbooks/synthesis.md"
    },
    {
      "id": "US-ID",
      "kind": "simulated",
      "about": "US-EVAL-008 confirmed non-interactively (campaign run)",
      "sourceCheckpoint": "state/US-EVAL-008/00-source.md"
    },
    {
      "id": "book-review",
      "kind": "simulated",
      "about": "generated test book (10 scenario blocks) presented and accepted as-is, non-interactive run",
      "sourceCheckpoint": "testbooks/synthesis.md"
    },
    {
      "id": "priorities",
      "kind": "simulated",
      "about": "all impact/probability/priority scores accepted as proposed, no human override",
      "sourceCheckpoint": "state/US-EVAL-008/04-priorities.md"
    },
    {
      "id": "extraction",
      "kind": "simulated",
      "about": "AC1..AC9 extraction accepted as-is, non-interactive run",
      "sourceCheckpoint": "state/US-EVAL-008/01-extraction.md"
    }
  ],
  "gate": {
    "score": 13,
    "max": 20,
    "scoredBy": "qaia-score/aptitude-gate",
    "at": "2026-07-31T00:00:00Z",
    "dimensions": [
      {
        "n": 1,
        "name": "Atomicity",
        "score": 1
      },
      {
        "n": 2,
        "name": "AC coverage",
        "score": 0
      },
      {
        "n": 3,
        "name": "Negative-path coverage (ADR 0001)",
        "score": 0
      },
      {
        "n": 5,
        "name": "Business correctness",
        "score": 1
      },
      {
        "n": 8,
        "name": "Gherkin form",
        "score": 1
      }
    ],
    "verdict": "FAIL",
    "reasons": [
      "hard gate: design.coverage.acCovered=5 < acTotal=9 -- AC1, AC5, AC6, AC9 have zero scenarios (coverage-matrix.md lists no row for them); rubric dim 2 = 0",
      "hard gate: design.coverage.reqNegCovered=3 < reqNegTotal=5 -- required negative conditions AC7-C1 and AC7-C2 uncovered (03-design.md 'Negative pressure'); rubric dim 3 = 0",
      "hard gate: rubric dimensions 2 and 3 scored 0 (any dimension at 0 is release-blocking)",
      "recomputed rubric total = 13/20 from the 10 dimension scores; matches gate.score=13 (no mismatch)",
      "3 open arbitrations pending human decision (Q1, Q2 assumptions; Q3 open) plus 7 'simulated' entries -- would cap at CONCERNS on their own, but FAIL takes precedence (rules applied in order)",
      "no execution block present in the manifest -- verdict rests on design + rubric evidence only",
      "note (not a band trigger): the AC/req-neg gaps are a disclosed P1+P2 priority-scope decision (04-priorities.md), not a hidden omission; the rubric and rule 1 provide no scope-aware carve-out, so the literal bands still produce FAIL"
    ],
    "waiver": null
  }
}
